{"$schema":"https://json-schema.org/draft/2020-12/schema","title":"Objective execution graph","type":"object","additionalProperties":false,"required":["objective","start_node","goal_node","nodes","edges"],"properties":{"objective":{"type":"string","minLength":1},"start_node":{"type":"string","minLength":1},"goal_node":{"type":"string","minLength":1},"nodes":{"type":"array","minItems":2,"items":{"type":"string","minLength":1}},"edges":{"type":"array","minItems":1,"items":{"type":"object"}}}}
