{
  "objective": "Keep Council execution focused on the macro objective while proving every critical path from request to release-ready delivery.",
  "start_node": "user_request",
  "goal_node": "release_ready_delivery",
  "nodes": [
    "user_request",
    "objective_controlled_plan",
    "graph_bound_execution",
    "proven_delivery",
    "portable_council",
    "independently_reviewed",
    "release_ready_delivery"
  ],
  "edges": [
    {
      "edge_id": "E1",
      "from": "user_request",
      "to": "objective_controlled_plan",
      "critical": true,
      "phase": "objective-control",
      "item": "score findings and preserve the macro north",
      "tests": {"functional": ["F-IMPACT"], "quality": ["Q-MACRO"], "regression": ["R-DEFER"]},
      "evidence": ["artifacts/council-macro-objective-upgrade/code-necessity.json", "artifacts/council-macro-objective-upgrade/command-receipts.json#C-RENDERED"]
    },
    {
      "edge_id": "E2",
      "from": "objective_controlled_plan",
      "to": "graph_bound_execution",
      "critical": true,
      "phase": "planning-and-execution",
      "item": "bind every critical edge to functional quality and regression tests",
      "tests": {"functional": ["F-GRAPH"], "quality": ["Q-ALL-CRITICAL"], "regression": ["R-BRANCH"]},
      "evidence": ["artifacts/council-macro-objective-upgrade/execution-graph.json", "artifacts/council-macro-objective-upgrade/command-receipts.json#C-RENDERED"]
    },
    {
      "edge_id": "E3",
      "from": "graph_bound_execution",
      "to": "proven_delivery",
      "critical": true,
      "phase": "evidence",
      "item": "prove commands commits blobs and code necessity",
      "tests": {"functional": ["F-COMMIT"], "quality": ["Q-REPLAY"], "regression": ["R-MERGE"]},
      "evidence": ["artifacts/council-macro-objective-upgrade/code-necessity.json", "artifacts/council-macro-objective-upgrade/command-receipts.json", "artifacts/council-macro-objective-upgrade/commit-ledger.json"]
    },
    {
      "edge_id": "E4",
      "from": "proven_delivery",
      "to": "portable_council",
      "critical": true,
      "phase": "portability",
      "item": "render the same operating contract in Claude and Codex",
      "tests": {"functional": ["F-RENDER"], "quality": ["Q-PARITY"], "regression": ["R-LOCALE"]},
      "evidence": ["artifacts/council-macro-objective-upgrade/command-receipts.json#C-CODEX", "artifacts/council-macro-objective-upgrade/command-receipts.json#C-RUNTIME-PARITY"]
    },
    {
      "edge_id": "E5",
      "from": "portable_council",
      "to": "independently_reviewed",
      "critical": true,
      "phase": "review",
      "item": "close independent quality and adversarial findings",
      "tests": {"functional": ["F-QUALITY"], "quality": ["Q-ADVERSARIAL"], "regression": ["R-NONBLOCK"]},
      "evidence": ["artifacts/council-macro-objective-upgrade/reviews/quality-final.md", "artifacts/council-macro-objective-upgrade/reviews/simplification-final.md", "artifacts/council-macro-objective-upgrade/reviews/adversarial-final.md", "artifacts/council-macro-objective-upgrade/reviews/adversarial-round-1.md", "artifacts/council-macro-objective-upgrade/reviews/adversarial-round-2.md"]
    },
    {
      "edge_id": "E6",
      "from": "independently_reviewed",
      "to": "release_ready_delivery",
      "critical": true,
      "phase": "delivery",
      "item": "publish an authorized branch without merging main",
      "tests": {"functional": ["F-AUTHORIZED-PUSH"], "quality": ["Q-PR-EVIDENCE"], "regression": ["R-NO-MERGE"]},
      "evidence": ["artifacts/council-macro-objective-upgrade/delivery-manifest.json"]
    }
  ]
}
